05:39:48.502496 IP (tos 0x0, ttl 64, id 65091, offset 0, flags [DF], proto TCP (6), length 60)
    169.254.144.1.55496 > 169.254.144.9.31276: Flags [S], cksum 0x5f73 (correct), seq 3208337768, win 29200, options [mss 1460,sackOK,TS val 1303071024 ecr 0,nop,wscale 7], length 0
05:39:48.503861 IP (tos 0x0, ttl 128, id 0, offset 0, flags [DF], proto TCP (6), length 40)
    169.254.144.9.31276 > 169.254.144.1.55496: Flags [S.], cksum 0xe780 (correct), seq 1995395520, ack 3208337769, win 8192, length 0
05:39:48.503892 IP (tos 0x0, ttl 64, id 65092, offset 0, flags [DF], proto TCP (6), length 40)
    169.254.144.1.55496 > 169.254.144.9.31276: Flags [.], cksum 0x9571 (correct), seq 1, ack 1, win 29200, length 0
05:39:48.511636 IP (tos 0x0, ttl 64, id 65093, offset 0, flags [DF], proto TCP (6), length 576)
    169.254.144.1.55496 > 169.254.144.9.31276: Flags [.], cksum 0x699f (correct), seq 1:537, ack 1, win 29200, length 536
05:39:48.511641 IP (tos 0x0, ttl 64, id 65094, offset 0, flags [DF], proto TCP (6), length 576)
    169.254.144.1.55496 > 169.254.144.9.31276: Flags [.], cksum 0x9569 (correct), seq 537:1073, ack 1, win 29200, length 536
05:39:48.511642 IP (tos 0x0, ttl 64, id 65095, offset 0, flags [DF], proto TCP (6), length 576)
    169.254.144.1.55496 > 169.254.144.9.31276: Flags [.], cksum 0x4801 (correct), seq 1073:1609, ack 1, win 29200, length 536
05:39:48.511643 IP (tos 0x0, ttl 64, id 65096, offset 0, flags [DF], proto TCP (6), length 576)
    169.254.144.1.55496 > 169.254.144.9.31276: Flags [.], cksum 0x0d02 (correct), seq 1609:2145, ack 1, win 29200, length 536
05:39:48.511644 IP (tos 0x0, ttl 64, id 65097, offset 0, flags [DF], proto TCP (6), length 576)
    169.254.144.1.55496 > 169.254.144.9.31276: Flags [.], cksum 0xbe09 (correct), seq 2145:2681, ack 1, win 29200, length 536
05:39:48.511656 IP (tos 0x0, ttl 64, id 65098, offset 0, flags [DF], proto TCP (6), length 576)
    169.254.144.1.55496 > 169.254.144.9.31276: Flags [.], cksum 0xddb9 (correct), seq 2681:3217, ack 1, win 29200, length 536
05:39:48.511657 IP (tos 0x0, ttl 64, id 65099, offset 0, flags [DF], proto TCP (6), length 576)
    169.254.144.1.55496 > 169.254.144.9.31276: Flags [.], cksum 0x3ded (correct), seq 3217:3753, ack 1, win 29200, length 536
05:39:48.519718 IP (tos 0x0, ttl 128, id 0, offset 0, flags [DF], proto TCP (6), length 40)
    169.254.144.9.31276 > 169.254.144.1.55496: Flags [F.], cksum 0xe780 (correct), seq 1, ack 537, win 7656, length 0
05:39:48.519742 IP (tos 0x0, ttl 64, id 65103, offset 0, flags [DF], proto TCP (6), length 576)
    169.254.144.1.55496 > 169.254.144.9.31276: Flags [.], cksum 0x9b3a (correct), seq 5361:5897, ack 2, win 29200, length 536
05:39:48.521387 IP (tos 0x0, ttl 128, id 0, offset 0, flags [DF], proto TCP (6), length 40)
    169.254.144.9.31276 > 169.254.144.1.55496: Flags [.], cksum 0xe780 (correct), seq 2, ack 1073, win 7120, length 0
05:39:48.521708 IP (tos 0x0, ttl 128, id 0, offset 0, flags [DF], proto TCP (6), length 40)
    169.254.144.9.31276 > 169.254.144.1.55496: Flags [.], cksum 0xe350 (correct), seq 2, ack 2145, win 7120, length 0
05:39:48.521727 IP (tos 0x0, ttl 64, id 65104, offset 0, flags [DF], proto TCP (6), length 576)
    169.254.144.1.55496 > 169.254.144.9.31276: Flags [.], cksum 0x5ae3 (correct), seq 5897:6433, ack 2, win 29200, length 536
05:39:48.521728 IP (tos 0x0, ttl 64, id 65105, offset 0, flags [DF], proto TCP (6), length 576)
    169.254.144.1.55496 > 169.254.144.9.31276: Flags [.], cksum 0x6364 (correct), seq 6433:6969, ack 2, win 29200, length 536
05:39:48.522082 IP (tos 0x0, ttl 128, id 0, offset 0, flags [DF], proto TCP (6), length 40)
    169.254.144.9.31276 > 169.254.144.1.55496: Flags [.], cksum 0xdf20 (correct), seq 2, ack 2681, win 7656, length 0
05:39:48.522099 IP (tos 0x0, ttl 64, id 65106, offset 0, flags [DF], proto TCP (6), length 576)
    169.254.144.1.55496 > 169.254.144.9.31276: Flags [.], cksum 0x9b3c (correct), seq 6969:7505, ack 2, win 29200, length 536
05:39:48.522100 IP (tos 0x0, ttl 64, id 65107, offset 0, flags [DF], proto TCP (6), length 576)
    169.254.144.1.55496 > 169.254.144.9.31276: Flags [.], cksum 0x82d5 (correct), seq 7505:8041, ack 2, win 29200, length 536
05:39:48.523107 IP (tos 0x0, ttl 128, id 0, offset 0, flags [DF], proto TCP (6), length 40)
    169.254.144.9.31276 > 169.254.144.1.55496: Flags [.], cksum 0xdaf0 (correct), seq 2, ack 3753, win 7656, length 0
05:39:48.523128 IP (tos 0x0, ttl 64, id 65108, offset 0, flags [DF], proto TCP (6), length 576)
    169.254.144.1.55496 > 169.254.144.9.31276: Flags [.], cksum 0xd048 (correct), seq 8041:8577, ack 2, win 29200, length 536
05:39:48.523129 IP (tos 0x0, ttl 64, id 65109, offset 0, flags [DF], proto TCP (6), length 576)
    169.254.144.1.55496 > 169.254.144.9.31276: Flags [.], cksum 0xa8b6 (correct), seq 8577:9113, ack 2, win 29200, length 536
05:39:48.524444 IP (tos 0x0, ttl 128, id 0, offset 0, flags [DF], proto TCP (6), length 40)
    169.254.144.9.31276 > 169.254.144.1.55496: Flags [.], cksum 0xdaf0 (correct), seq 2, ack 4289, win 7120, length 0
05:39:48.524818 IP (tos 0x0, ttl 128, id 0, offset 0, flags [DF], proto TCP (6), length 40)
    169.254.144.9.31276 > 169.254.144.1.55496: Flags [.], cksum 0xd6c0 (correct), seq 2, ack 4825, win 7656, length 0
05:39:48.524836 IP (tos 0x0, ttl 64, id 65110, offset 0, flags [DF], proto TCP (6), length 576)
    169.254.144.1.55496 > 169.254.144.9.31276: Flags [.], cksum 0xf95f (correct), seq 9113:9649, ack 2, win 29200, length 536
05:39:48.524837 IP (tos 0x0, ttl 64, id 65111, offset 0, flags [DF], proto TCP (6), length 576)
    169.254.144.1.55496 > 169.254.144.9.31276: Flags [.], cksum 0xd69f (correct), seq 9649:10185, ack 2, win 29200, length 536
05:39:48.525340 IP (tos 0x0, ttl 128, id 0, offset 0, flags [DF], proto TCP (6), length 40)
    169.254.144.9.31276 > 169.254.144.1.55496: Flags [.], cksum 0xd6c0 (correct), seq 2, ack 5361, win 7120, length 0
05:39:48.525697 IP (tos 0x0, ttl 128, id 0, offset 0, flags [DF], proto TCP (6), length 40)
    169.254.144.9.31276 > 169.254.144.1.55496: Flags [.], cksum 0xd290 (correct), seq 2, ack 5897, win 7656, length 0
05:39:48.525729 IP (tos 0x0, ttl 64, id 65112, offset 0, flags [DF], proto TCP (6), length 576)
    169.254.144.1.55496 > 169.254.144.9.31276: Flags [.], cksum 0x0d32 (correct), seq 10185:10721, ack 2, win 29200, length 536
05:39:48.525729 IP (tos 0x0, ttl 64, id 65113, offset 0, flags [DF], proto TCP (6), length 576)
    169.254.144.1.55496 > 169.254.144.9.31276: Flags [.], cksum 0xe661 (correct), seq 10721:11257, ack 2, win 29200, length 536
05:39:48.526960 IP (tos 0x0, ttl 128, id 0, offset 0, flags [DF], proto TCP (6), length 40)
    169.254.144.9.31276 > 169.254.144.1.55496: Flags [.], cksum 0xd290 (correct), seq 2, ack 6433, win 7120, length 0
05:39:48.526971 IP (tos 0x0, ttl 64, id 65114, offset 0, flags [DF], proto TCP (6), length 576)
    169.254.144.1.55496 > 169.254.144.9.31276: Flags [.], cksum 0x8557 (correct), seq 11257:11793, ack 2, win 29200, length 536
05:39:48.527177 IP (tos 0x0, ttl 128, id 0, offset 0, flags [DF], proto TCP (6), length 40)
    169.254.144.9.31276 > 169.254.144.1.55496: Flags [.], cksum 0xce60 (correct), seq 2, ack 6433, win 8192, length 0
05:39:48.527205 IP (tos 0x0, ttl 128, id 0, offset 0, flags [DF], proto TCP (6), length 40)
    169.254.144.9.31276 > 169.254.144.1.55496: Flags [.], cksum 0xce60 (correct), seq 2, ack 6433, win 8192, length 0
05:39:48.527300 IP (tos 0x0, ttl 128, id 0, offset 0, flags [DF], proto TCP (6), length 40)
    169.254.144.9.31276 > 169.254.144.1.55496: Flags [.], cksum 0xce60 (correct), seq 2, ack 6433, win 8192, length 0
05:39:48.527309 IP (tos 0x0, ttl 64, id 65115, offset 0, flags [DF], proto TCP (6), length 576)
    169.254.144.1.55496 > 169.254.144.9.31276: Flags [.], cksum 0xe6e8 (correct), seq 11793:12329, ack 2, win 29200, length 536
05:39:48.527309 IP (tos 0x0, ttl 64, id 65116, offset 0, flags [DF], proto TCP (6), length 576)
    169.254.144.1.55496 > 169.254.144.9.31276: Flags [P.], cksum 0x0341 (correct), seq 12329:12865, ack 2, win 29200, length 536
05:39:48.527410 IP (tos 0x0, ttl 128, id 0, offset 0, flags [DF], proto TCP (6), length 40)
    169.254.144.9.31276 > 169.254.144.1.55496: Flags [.], cksum 0xce60 (correct), seq 2, ack 6433, win 8192, length 0
05:39:48.527417 IP (tos 0x0, ttl 64, id 65117, offset 0, flags [DF], proto TCP (6), length 576)
    169.254.144.1.55496 > 169.254.144.9.31276: Flags [.], cksum 0x6364 (correct), seq 6433:6969, ack 2, win 29200, length 536
05:39:48.527444 IP (tos 0x0, ttl 128, id 0, offset 0, flags [DF], proto TCP (6), length 40)
    169.254.144.9.31276 > 169.254.144.1.55496: Flags [.], cksum 0xce60 (correct), seq 2, ack 6433, win 8192, length 0
05:39:48.527449 IP (tos 0x0, ttl 64, id 65118, offset 0, flags [DF], proto TCP (6), length 576)
    169.254.144.1.55496 > 169.254.144.9.31276: Flags [.], cksum 0x4933 (correct), seq 12865:13401, ack 2, win 29200, length 536
05:39:48.527542 IP (tos 0x0, ttl 128, id 0, offset 0, flags [DF], proto TCP (6), length 40)
    169.254.144.9.31276 > 169.254.144.1.55496: Flags [.], cksum 0xce60 (correct), seq 2, ack 6433, win 8192, length 0
05:39:48.527547 IP (tos 0x0, ttl 64, id 65119, offset 0, flags [DF], proto TCP (6), length 576)
    169.254.144.1.55496 > 169.254.144.9.31276: Flags [.], cksum 0xd16d (correct), seq 13401:13937, ack 2, win 29200, length 536
05:39:48.527975 IP (tos 0x0, ttl 128, id 0, offset 0, flags [DF], proto TCP (6), length 40)
    169.254.144.9.31276 > 169.254.144.1.55496: Flags [.], cksum 0xce60 (correct), seq 2, ack 6433, win 8192, length 0
05:39:48.528084 IP (tos 0x0, ttl 128, id 0, offset 0, flags [DF], proto TCP (6), length 40)
    169.254.144.9.31276 > 169.254.144.1.55496: Flags [.], cksum 0xce60 (correct), seq 2, ack 6433, win 8192, length 0
05:39:48.528109 IP (tos 0x0, ttl 128, id 0, offset 0, flags [DF], proto TCP (6), length 40)
    169.254.144.9.31276 > 169.254.144.1.55496: Flags [.], cksum 0xce60 (correct), seq 2, ack 6433, win 8192, length 0
05:39:48.528115 IP (tos 0x0, ttl 64, id 65120, offset 0, flags [DF], proto TCP (6), length 576)
    169.254.144.1.55496 > 169.254.144.9.31276: Flags [.], cksum 0xc434 (correct), seq 13937:14473, ack 2, win 29200, length 536
05:39:48.528378 IP (tos 0x0, ttl 128, id 0, offset 0, flags [DF], proto TCP (6), length 40)
    169.254.144.9.31276 > 169.254.144.1.55496: Flags [.], cksum 0xce60 (correct), seq 2, ack 8577, win 6048, length 0
05:39:48.528386 IP (tos 0x0, ttl 64, id 65121, offset 0, flags [DF], proto TCP (6), length 576)
    169.254.144.1.55496 > 169.254.144.9.31276: Flags [.], cksum 0xa8b6 (correct), seq 8577:9113, ack 2, win 29200, length 536
05:39:48.528415 IP (tos 0x0, ttl 128, id 0, offset 0, flags [DF], proto TCP (6), length 40)
    169.254.144.9.31276 > 169.254.144.1.55496: Flags [.], cksum 0xc600 (correct), seq 2, ack 8577, win 8192, length 0
05:39:48.528420 IP (tos 0x0, ttl 64, id 65122, offset 0, flags [DF], proto TCP (6), length 576)
    169.254.144.1.55496 > 169.254.144.9.31276: Flags [.], cksum 0x87e2 (correct), seq 14473:15009, ack 2, win 29200, length 536
05:39:48.528514 IP (tos 0x0, ttl 128, id 0, offset 0, flags [DF], proto TCP (6), length 40)
    169.254.144.9.31276 > 169.254.144.1.55496: Flags [.], cksum 0xc600 (correct), seq 2, ack 8577, win 8192, length 0
05:39:48.528521 IP (tos 0x0, ttl 64, id 65123, offset 0, flags [DF], proto TCP (6), length 576)
    169.254.144.1.55496 > 169.254.144.9.31276: Flags [.], cksum 0x437e (correct), seq 15009:15545, ack 2, win 29200, length 536
05:39:48.530375 IP (tos 0x0, ttl 128, id 0, offset 0, flags [DF], proto TCP (6), length 40)
    169.254.144.9.31276 > 169.254.144.1.55496: Flags [.], cksum 0xc600 (correct), seq 2, ack 14473, win 2296, length 0
05:39:48.530398 IP (tos 0x0, ttl 64, id 65124, offset 0, flags [DF], proto TCP (6), length 576)
    169.254.144.1.55496 > 169.254.144.9.31276: Flags [.], cksum 0x198c (correct), seq 15545:16081, ack 2, win 29200, length 536
05:39:48.530399 IP (tos 0x0, ttl 64, id 65125, offset 0, flags [DF], proto TCP (6), length 576)
    169.254.144.1.55496 > 169.254.144.9.31276: Flags [.], cksum 0x3d99 (correct), seq 16081:16617, ack 2, win 29200, length 536
05:39:48.530964 IP (tos 0x0, ttl 128, id 0, offset 0, flags [DF], proto TCP (6), length 40)
    169.254.144.9.31276 > 169.254.144.1.55496: Flags [.], cksum 0xc600 (correct), seq 2, ack 15009, win 1760, length 0
05:39:48.531705 IP (tos 0x0, ttl 128, id 0, offset 0, flags [DF], proto TCP (6), length 40)
    169.254.144.9.31276 > 169.254.144.1.55496: Flags [.], cksum 0xace0 (correct), seq 2, ack 15545, win 7656, length 0
05:39:48.531731 IP (tos 0x0, ttl 64, id 65126, offset 0, flags [DF], proto TCP (6), length 576)
    169.254.144.1.55496 > 169.254.144.9.31276: Flags [.], cksum 0x69cb (correct), seq 16617:17153, ack 2, win 29200, length 536
05:39:48.531732 IP (tos 0x0, ttl 64, id 65127, offset 0, flags [DF], proto TCP (6), length 576)
    169.254.144.1.55496 > 169.254.144.9.31276: Flags [.], cksum 0x935f (correct), seq 17153:17689, ack 2, win 29200, length 536
05:39:48.531736 IP (tos 0x0, ttl 64, id 65128, offset 0, flags [DF], proto TCP (6), length 576)
    169.254.144.1.55496 > 169.254.144.9.31276: Flags [.], cksum 0x580a (correct), seq 17689:18225, ack 2, win 29200, length 536
05:39:48.531736 IP (tos 0x0, ttl 64, id 65129, offset 0, flags [DF], proto TCP (6), length 576)
    169.254.144.1.55496 > 169.254.144.9.31276: Flags [.], cksum 0x9334 (correct), seq 18225:18761, ack 2, win 29200, length 536
05:39:48.531739 IP (tos 0x0, ttl 64, id 65130, offset 0, flags [DF], proto TCP (6), length 576)
    169.254.144.1.55496 > 169.254.144.9.31276: Flags [.], cksum 0x94d0 (correct), seq 18761:19297, ack 2, win 29200, length 536
05:39:48.532067 IP (tos 0x0, ttl 128, id 0, offset 0, flags [DF], proto TCP (6), length 40)
    169.254.144.9.31276 > 169.254.144.1.55496: Flags [.], cksum 0xace0 (correct), seq 2, ack 16081, win 7120, length 0
05:39:48.532078 IP (tos 0x0, ttl 64, id 65131, offset 0, flags [DF], proto TCP (6), length 576)
    169.254.144.1.55496 > 169.254.144.9.31276: Flags [.], cksum 0x5e98 (correct), seq 19297:19833, ack 2, win 29200, length 536
05:39:48.532114 IP (tos 0x0, ttl 128, id 0, offset 0, flags [DF], proto TCP (6), length 40)
    169.254.144.9.31276 > 169.254.144.1.55496: Flags [.], cksum 0xa8b0 (correct), seq 2, ack 16617, win 7656, length 0
05:39:48.532121 IP (tos 0x0, ttl 64, id 65132, offset 0, flags [DF], proto TCP (6), length 576)
    169.254.144.1.55496 > 169.254.144.9.31276: Flags [.], cksum 0x8d1b (correct), seq 19833:20369, ack 2, win 29200, length 536
05:39:48.532123 IP (tos 0x0, ttl 64, id 65133, offset 0, flags [DF], proto TCP (6), length 576)
    169.254.144.1.55496 > 169.254.144.9.31276: Flags [.], cksum 0xd073 (correct), seq 20369:20905, ack 2, win 29200, length 536
05:39:48.532393 IP (tos 0x0, ttl 128, id 0, offset 0, flags [DF], proto TCP (6), length 40)
    169.254.144.9.31276 > 169.254.144.1.55496: Flags [.], cksum 0xa698 (correct), seq 2, ack 16617, win 8192, length 0
05:39:48.532421 IP (tos 0x0, ttl 128, id 0, offset 0, flags [DF], proto TCP (6), length 40)
    169.254.144.9.31276 > 169.254.144.1.55496: Flags [.], cksum 0xa698 (correct), seq 2, ack 16617, win 8192, length 0
05:39:48.532427 IP (tos 0x0, ttl 64, id 65134, offset 0, flags [DF], proto TCP (6), length 576)
    169.254.144.1.55496 > 169.254.144.9.31276: Flags [.], cksum 0xbc4c (correct), seq 20905:21441, ack 2, win 29200, length 536
05:39:48.532567 IP (tos 0x0, ttl 128, id 0, offset 0, flags [DF], proto TCP (6), length 40)
    169.254.144.9.31276 > 169.254.144.1.55496: Flags [.], cksum 0xa698 (correct), seq 2, ack 16617, win 8192, length 0
05:39:48.532577 IP (tos 0x0, ttl 64, id 65135, offset 0, flags [DF], proto TCP (6), length 576)
    169.254.144.1.55496 > 169.254.144.9.31276: Flags [.], cksum 0xae1a (correct), seq 21441:21977, ack 2, win 29200, length 536
05:39:48.533660 IP (tos 0x0, ttl 128, id 0, offset 0, flags [DF], proto TCP (6), length 40)
    169.254.144.9.31276 > 169.254.144.1.55496: Flags [.], cksum 0xa698 (correct), seq 2, ack 16617, win 8192, length 0
05:39:48.533675 IP (tos 0x0, ttl 64, id 65136, offset 0, flags [DF], proto TCP (6), length 576)
    169.254.144.1.55496 > 169.254.144.9.31276: Flags [.], cksum 0x69cb (correct), seq 16617:17153, ack 2, win 29200, length 536
05:39:48.533859 IP (tos 0x0, ttl 128, id 0, offset 0, flags [DF], proto TCP (6), length 40)
    169.254.144.9.31276 > 169.254.144.1.55496: Flags [.], cksum 0xa698 (correct), seq 2, ack 16617, win 8192, length 0
05:39:48.533867 IP (tos 0x0, ttl 64, id 65137, offset 0, flags [DF], proto TCP (6), length 576)
    169.254.144.1.55496 > 169.254.144.9.31276: Flags [.], cksum 0x3c78 (correct), seq 21977:22513, ack 2, win 29200, length 536
05:39:48.533897 IP (tos 0x0, ttl 128, id 0, offset 0, flags [DF], proto TCP (6), length 40)
    169.254.144.9.31276 > 169.254.144.1.55496: Flags [.], cksum 0xa698 (correct), seq 2, ack 16617, win 8192, length 0
05:39:48.533992 IP (tos 0x0, ttl 128, id 0, offset 0, flags [DF], proto TCP (6), length 40)
    169.254.144.9.31276 > 169.254.144.1.55496: Flags [.], cksum 0xa698 (correct), seq 2, ack 16617, win 8192, length 0
05:39:48.534015 IP (tos 0x0, ttl 128, id 0, offset 0, flags [DF], proto TCP (6), length 40)
    169.254.144.9.31276 > 169.254.144.1.55496: Flags [.], cksum 0xa698 (correct), seq 2, ack 16617, win 8192, length 0
05:39:48.534019 IP (tos 0x0, ttl 64, id 65138, offset 0, flags [DF], proto TCP (6), length 576)
    169.254.144.1.55496 > 169.254.144.9.31276: Flags [.], cksum 0x2136 (correct), seq 22513:23049, ack 2, win 29200, length 536
05:39:48.534113 IP (tos 0x0, ttl 128, id 0, offset 0, flags [DF], proto TCP (6), length 40)
    169.254.144.9.31276 > 169.254.144.1.55496: Flags [.], cksum 0xa698 (correct), seq 2, ack 16617, win 8192, length 0
05:39:48.534119 IP (tos 0x0, ttl 64, id 65139, offset 0, flags [DF], proto TCP (6), length 576)
    169.254.144.1.55496 > 169.254.144.9.31276: Flags [.], cksum 0x1b23 (correct), seq 23049:23585, ack 2, win 29200, length 536
05:39:48.534143 IP (tos 0x0, ttl 128, id 0, offset 0, flags [DF], proto TCP (6), length 40)
    169.254.144.9.31276 > 169.254.144.1.55496: Flags [.], cksum 0xa698 (correct), seq 2, ack 21977, win 2832, length 0
05:39:48.534149 IP (tos 0x0, ttl 64, id 65140, offset 0, flags [DF], proto TCP (6), length 576)
    169.254.144.1.55496 > 169.254.144.9.31276: Flags [P.], cksum 0x9cca (correct), seq 23585:24121, ack 2, win 29200, length 536
05:39:48.534151 IP (tos 0x0, ttl 64, id 65141, offset 0, flags [DF], proto TCP (6), length 576)
    169.254.144.1.55496 > 169.254.144.9.31276: Flags [.], cksum 0x786b (correct), seq 24121:24657, ack 2, win 29200, length 536
05:39:48.534356 IP (tos 0x0, ttl 128, id 0, offset 0, flags [DF], proto TCP (6), length 40)
    169.254.144.9.31276 > 169.254.144.1.55496: Flags [.], cksum 0xa698 (correct), seq 2, ack 22513, win 2296, length 0
05:39:48.534414 IP (tos 0x0, ttl 128, id 0, offset 0, flags [DF], proto TCP (6), length 40)
    169.254.144.9.31276 > 169.254.144.1.55496: Flags [.], cksum 0x8f90 (correct), seq 2, ack 23049, win 7656, length 0
05:39:48.534423 IP (tos 0x0, ttl 64, id 65142, offset 0, flags [DF], proto TCP (6), length 576)
    169.254.144.1.55496 > 169.254.144.9.31276: Flags [.], cksum 0xdfcc (correct), seq 24657:25193, ack 2, win 29200, length 536
05:39:48.534424 IP (tos 0x0, ttl 64, id 65143, offset 0, flags [DF], proto TCP (6), length 576)
    169.254.144.1.55496 > 169.254.144.9.31276: Flags [.], cksum 0x3aea (correct), seq 25193:25729, ack 2, win 29200, length 536
05:39:48.534426 IP (tos 0x0, ttl 64, id 65144, offset 0, flags [DF], proto TCP (6), length 576)
    169.254.144.1.55496 > 169.254.144.9.31276: Flags [.], cksum 0x39e8 (correct), seq 25729:26265, ack 2, win 29200, length 536
05:39:48.534426 IP (tos 0x0, ttl 64, id 65145, offset 0, flags [DF], proto TCP (6), length 576)
    169.254.144.1.55496 > 169.254.144.9.31276: Flags [.], cksum 0x69b1 (correct), seq 26265:26801, ack 2, win 29200, length 536
05:39:48.534428 IP (tos 0x0, ttl 64, id 65146, offset 0, flags [DF], proto TCP (6), length 576)
    169.254.144.1.55496 > 169.254.144.9.31276: Flags [.], cksum 0xbb6c (correct), seq 26801:27337, ack 2, win 29200, length 536
05:39:48.534684 IP (tos 0x0, ttl 128, id 0, offset 0, flags [DF], proto TCP (6), length 40)
    169.254.144.9.31276 > 169.254.144.1.55496: Flags [.], cksum 0x8f90 (correct), seq 2, ack 23585, win 7120, length 0
05:39:48.534694 IP (tos 0x0, ttl 64, id 65147, offset 0, flags [DF], proto TCP (6), length 576)
    169.254.144.1.55496 > 169.254.144.9.31276: Flags [.], cksum 0xe1c8 (correct), seq 27337:27873, ack 2, win 29200, length 536
05:39:48.534722 IP (tos 0x0, ttl 128, id 0, offset 0, flags [DF], proto TCP (6), length 40)
    169.254.144.9.31276 > 169.254.144.1.55496: Flags [.], cksum 0x8b60 (correct), seq 2, ack 24121, win 7656, length 0
05:39:48.534728 IP (tos 0x0, ttl 64, id 65148, offset 0, flags [DF], proto TCP (6), length 576)
    169.254.144.1.55496 > 169.254.144.9.31276: Flags [.], cksum 0xd8af (correct), seq 27873:28409, ack 2, win 29200, length 536
05:39:48.534918 IP (tos 0x0, ttl 128, id 0, offset 0, flags [DF], proto TCP (6), length 40)
    169.254.144.9.31276 > 169.254.144.1.55496: Flags [.], cksum 0x8b60 (correct), seq 2, ack 24657, win 7120, length 0
05:39:48.534926 IP (tos 0x0, ttl 64, id 65149, offset 0, flags [DF], proto TCP (6), length 576)
    169.254.144.1.55496 > 169.254.144.9.31276: Flags [.], cksum 0x568c (correct), seq 28409:28945, ack 2, win 29200, length 536
05:39:48.534954 IP (tos 0x0, ttl 128, id 0, offset 0, flags [DF], proto TCP (6), length 40)
    169.254.144.9.31276 > 169.254.144.1.55496: Flags [.], cksum 0x8730 (correct), seq 2, ack 25193, win 7656, length 0
05:39:48.534960 IP (tos 0x0, ttl 64, id 65150, offset 0, flags [DF], proto TCP (6), length 576)
    169.254.144.1.55496 > 169.254.144.9.31276: Flags [.], cksum 0xfd71 (correct), seq 28945:29481, ack 2, win 29200, length 536
05:39:48.538703 IP (tos 0x0, ttl 128, id 0, offset 0, flags [DF], proto TCP (6), length 40)
    169.254.144.9.31276 > 169.254.144.1.55496: Flags [.], cksum 0x8730 (correct), seq 2, ack 25729, win 7120, length 0
05:39:48.538716 IP (tos 0x0, ttl 64, id 65151, offset 0, flags [DF], proto TCP (6), length 576)
    169.254.144.1.55496 > 169.254.144.9.31276: Flags [.], cksum 0x2b05 (correct), seq 29481:30017, ack 2, win 29200, length 536
05:39:48.538772 IP (tos 0x0, ttl 128, id 0, offset 0, flags [DF], proto TCP (6), length 40)
    169.254.144.9.31276 > 169.254.144.1.55496: Flags [.], cksum 0x8300 (correct), seq 2, ack 26265, win 7656, length 0
05:39:48.539098 IP (tos 0x0, ttl 128, id 0, offset 0, flags [DF], proto TCP (6), length 40)
    169.254.144.9.31276 > 169.254.144.1.55496: Flags [.], cksum 0x8300 (correct), seq 2, ack 26801, win 7120, length 0
05:39:48.539112 IP (tos 0x0, ttl 64, id 65152, offset 0, flags [DF], proto TCP (6), length 576)
    169.254.144.1.55496 > 169.254.144.9.31276: Flags [.], cksum 0xa752 (correct), seq 30017:30553, ack 2, win 29200, length 536
05:39:48.539113 IP (tos 0x0, ttl 64, id 65153, offset 0, flags [DF], proto TCP (6), length 576)
    169.254.144.1.55496 > 169.254.144.9.31276: Flags [.], cksum 0x7a7d (correct), seq 30553:31089, ack 2, win 29200, length 536
05:39:48.539740 IP (tos 0x0, ttl 128, id 0, offset 0, flags [DF], proto TCP (6), length 40)
    169.254.144.9.31276 > 169.254.144.1.55496: Flags [.], cksum 0x7ed0 (correct), seq 2, ack 27337, win 7656, length 0
05:39:48.539752 IP (tos 0x0, ttl 64, id 65154, offset 0, flags [DF], proto TCP (6), length 576)
    169.254.144.1.55496 > 169.254.144.9.31276: Flags [P.], cksum 0x00ef (correct), seq 31089:31625, ack 2, win 29200, length 536
05:39:48.540003 IP (tos 0x0, ttl 128, id 0, offset 0, flags [DF], proto TCP (6), length 40)
    169.254.144.9.31276 > 169.254.144.1.55496: Flags [.], cksum 0x7aa0 (correct), seq 2, ack 28409, win 7656, length 0
05:39:48.540014 IP (tos 0x0, ttl 64, id 65155, offset 0, flags [DF], proto TCP (6), length 576)
    169.254.144.1.55496 > 169.254.144.9.31276: Flags [.], cksum 0x8d02 (correct), seq 31625:32161, ack 2, win 29200, length 536
05:39:48.540014 IP (tos 0x0, ttl 64, id 65156, offset 0, flags [DF], proto TCP (6), length 576)
    169.254.144.1.55496 > 169.254.144.9.31276: Flags [.], cksum 0xb5d0 (correct), seq 32161:32697, ack 2, win 29200, length 536
05:39:48.540254 IP (tos 0x0, ttl 128, id 0, offset 0, flags [DF], proto TCP (6), length 40)
    169.254.144.9.31276 > 169.254.144.1.55496: Flags [.], cksum 0x7aa0 (correct), seq 2, ack 28945, win 7120, length 0
05:39:48.540578 IP (tos 0x0, ttl 128, id 0, offset 0, flags [DF], proto TCP (6), length 40)
    169.254.144.9.31276 > 169.254.144.1.55496: Flags [.], cksum 0x7670 (correct), seq 2, ack 29481, win 7656, length 0
05:39:48.540590 IP (tos 0x0, ttl 64, id 65157, offset 0, flags [DF], proto TCP (6), length 576)
    169.254.144.1.55496 > 169.254.144.9.31276: Flags [.], cksum 0xe5ab (correct), seq 32697:33233, ack 2, win 29200, length 536
05:39:48.540591 IP (tos 0x0, ttl 64, id 65158, offset 0, flags [DF], proto TCP (6), length 576)
    169.254.144.1.55496 > 169.254.144.9.31276: Flags [.], cksum 0x5534 (correct), seq 33233:33769, ack 2, win 29200, length 536
05:39:48.540789 IP (tos 0x0, ttl 128, id 0, offset 0, flags [DF], proto TCP (6), length 40)
    169.254.144.9.31276 > 169.254.144.1.55496: Flags [.], cksum 0x7670 (correct), seq 2, ack 30017, win 7120, length 0
05:39:48.540796 IP (tos 0x0, ttl 64, id 65159, offset 0, flags [DF], proto TCP (6), length 576)
    169.254.144.1.55496 > 169.254.144.9.31276: Flags [.], cksum 0x2eb0 (correct), seq 33769:34305, ack 2, win 29200, length 536
05:39:48.540823 IP (tos 0x0, ttl 128, id 0, offset 0, flags [DF], proto TCP (6), length 40)
    169.254.144.9.31276 > 169.254.144.1.55496: Flags [.], cksum 0x7240 (correct), seq 2, ack 30553, win 7656, length 0
05:39:48.540828 IP (tos 0x0, ttl 64, id 65160, offset 0, flags [DF], proto TCP (6), length 576)
    169.254.144.1.55496 > 169.254.144.9.31276: Flags [.], cksum 0xd49c (correct), seq 34305:34841, ack 2, win 29200, length 536
05:39:48.540993 IP (tos 0x0, ttl 128, id 0, offset 0, flags [DF], proto TCP (6), length 40)
    169.254.144.9.31276 > 169.254.144.1.55496: Flags [.], cksum 0x7240 (correct), seq 2, ack 31089, win 7120, length 0
05:39:48.541000 IP (tos 0x0, ttl 64, id 65161, offset 0, flags [DF], proto TCP (6), length 576)
    169.254.144.1.55496 > 169.254.144.9.31276: Flags [.], cksum 0xf1f8 (correct), seq 34841:35377, ack 2, win 29200, length 536
05:39:48.542267 IP (tos 0x0, ttl 128, id 0, offset 0, flags [DF], proto TCP (6), length 40)
    169.254.144.9.31276 > 169.254.144.1.55496: Flags [.], cksum 0x6e10 (correct), seq 2, ack 31089, win 8192, length 0
05:39:48.542346 IP (tos 0x0, ttl 128, id 0, offset 0, flags [DF], proto TCP (6), length 40)
    169.254.144.9.31276 > 169.254.144.1.55496: Flags [.], cksum 0x6e10 (correct), seq 2, ack 31089, win 8192, length 0
05:39:48.542448 IP (tos 0x0, ttl 128, id 0, offset 0, flags [DF], proto TCP (6), length 40)
    169.254.144.9.31276 > 169.254.144.1.55496: Flags [.], cksum 0x6e10 (correct), seq 2, ack 31089, win 8192, length 0
05:39:48.542459 IP (tos 0x0, ttl 64, id 65162, offset 0, flags [DF], proto TCP (6), length 576)
    169.254.144.1.55496 > 169.254.144.9.31276: Flags [.], cksum 0xf084 (correct), seq 35377:35913, ack 2, win 29200, length 536
05:39:48.542459 IP (tos 0x0, ttl 64, id 65163, offset 0, flags [DF], proto TCP (6), length 576)
    169.254.144.1.55496 > 169.254.144.9.31276: Flags [.], cksum 0x600e (correct), seq 35913:36449, ack 2, win 29200, length 536
05:39:48.542492 IP (tos 0x0, ttl 128, id 0, offset 0, flags [DF], proto TCP (6), length 40)
    169.254.144.9.31276 > 169.254.144.1.55496: Flags [.], cksum 0x6e10 (correct), seq 2, ack 31089, win 8192, length 0
05:39:48.542499 IP (tos 0x0, ttl 64, id 65164, offset 0, flags [DF], proto TCP (6), length 576)
    169.254.144.1.55496 > 169.254.144.9.31276: Flags [P.], cksum 0x00ef (correct), seq 31089:31625, ack 2, win 29200, length 536
05:39:48.542592 IP (tos 0x0, ttl 128, id 0, offset 0, flags [DF], proto TCP (6), length 40)
    169.254.144.9.31276 > 169.254.144.1.55496: Flags [.], cksum 0x6e10 (correct), seq 2, ack 31089, win 8192, length 0
05:39:48.542598 IP (tos 0x0, ttl 64, id 65165, offset 0, flags [DF], proto TCP (6), length 576)
    169.254.144.1.55496 > 169.254.144.9.31276: Flags [.], cksum 0x5291 (correct), seq 36449:36985, ack 2, win 29200, length 536
05:39:48.542624 IP (tos 0x0, ttl 128, id 0, offset 0, flags [DF], proto TCP (6), length 40)
    169.254.144.9.31276 > 169.254.144.1.55496: Flags [.], cksum 0x6e10 (correct), seq 2, ack 31089, win 8192, length 0
05:39:48.542740 IP (tos 0x0, ttl 128, id 0, offset 0, flags [DF], proto TCP (6), length 40)
    169.254.144.9.31276 > 169.254.144.1.55496: Flags [.], cksum 0x6e10 (correct), seq 2, ack 31089, win 8192, length 0
05:39:48.566438 IP (tos 0x0, ttl 64, id 65166, offset 0, flags [DF], proto TCP (6), length 576)
    169.254.144.1.55496 > 169.254.144.9.31276: Flags [P.], cksum 0x00ef (correct), seq 31089:31625, ack 2, win 29200, length 536
05:39:48.618029 IP (tos 0x0, ttl 64, id 65167, offset 0, flags [DF], proto TCP (6), length 576)
    169.254.144.1.55496 > 169.254.144.9.31276: Flags [P.], cksum 0x00ef (correct), seq 31089:31625, ack 2, win 29200, length 536
05:39:48.618241 IP (tos 0x0, ttl 128, id 0, offset 0, flags [DF], proto TCP (6), length 40)
    169.254.144.9.31276 > 169.254.144.1.55496: Flags [.], cksum 0x5f68 (correct), seq 2, ack 34841, win 8192, length 0
05:39:48.618265 IP (tos 0x0, ttl 64, id 65168, offset 0, flags [DF], proto TCP (6), length 576)
    169.254.144.1.55496 > 169.254.144.9.31276: Flags [.], cksum 0x9806 (correct), seq 36985:37521, ack 2, win 29200, length 536
05:39:48.618266 IP (tos 0x0, ttl 64, id 65169, offset 0, flags [DF], proto TCP (6), length 576)
    169.254.144.1.55496 > 169.254.144.9.31276: Flags [.], cksum 0x311a (correct), seq 37521:38057, ack 2, win 29200, length 536
05:39:48.618269 IP (tos 0x0, ttl 64, id 65170, offset 0, flags [DF], proto TCP (6), length 576)
    169.254.144.1.55496 > 169.254.144.9.31276: Flags [.], cksum 0xcc39 (correct), seq 38057:38593, ack 2, win 29200, length 536
05:39:48.618269 IP (tos 0x0, ttl 64, id 65171, offset 0, flags [DF], proto TCP (6), length 576)
    169.254.144.1.55496 > 169.254.144.9.31276: Flags [P.], cksum 0x0628 (correct), seq 38593:39129, ack 2, win 29200, length 536
05:39:48.618398 IP (tos 0x0, ttl 128, id 0, offset 0, flags [DF], proto TCP (6), length 40)
    169.254.144.9.31276 > 169.254.144.1.55496: Flags [.], cksum 0x5f68 (correct), seq 2, ack 34841, win 8192, length 0
05:39:48.618406 IP (tos 0x0, ttl 128, id 0, offset 0, flags [DF], proto TCP (6), length 40)
    169.254.144.9.31276 > 169.254.144.1.55496: Flags [.], cksum 0x5f68 (correct), seq 2, ack 34841, win 8192, length 0
05:39:48.718558 IP (tos 0x0, ttl 64, id 65176, offset 0, flags [DF], proto TCP (6), length 576)
    169.254.144.1.55496 > 169.254.144.9.31276: Flags [.], cksum 0x5291 (correct), seq 36449:36985, ack 2, win 29200, length 536
05:39:48.914502 IP (tos 0x0, ttl 64, id 65177, offset 0, flags [DF], proto TCP (6), length 576)
    169.254.144.1.55496 > 169.254.144.9.31276: Flags [.], cksum 0x5291 (correct), seq 36449:36985, ack 2, win 29200, length 536
05:39:49.322809 IP (tos 0x0, ttl 64, id 65178, offset 0, flags [DF], proto TCP (6), length 576)
    169.254.144.1.55496 > 169.254.144.9.31276: Flags [.], cksum 0x5291 (correct), seq 36449:36985, ack 2, win 29200, length 536
05:39:49.331464 IP (tos 0x0, ttl 128, id 0, offset 0, flags [DF], proto TCP (6), length 40)
    169.254.144.9.31276 > 169.254.144.1.55496: Flags [.], cksum 0x5920 (correct), seq 2, ack 38593, win 6048, length 0
05:39:49.331527 IP (tos 0x0, ttl 64, id 65179, offset 0, flags [DF], proto TCP (6), length 576)
    169.254.144.1.55496 > 169.254.144.9.31276: Flags [.], cksum 0x2ce2 (correct), seq 40737:41273, ack 2, win 29200, length 536
05:39:49.331530 IP (tos 0x0, ttl 64, id 65180, offset 0, flags [DF], proto TCP (6), length 576)
    169.254.144.1.55496 > 169.254.144.9.31276: Flags [.], cksum 0x1856 (correct), seq 41273:41809, ack 2, win 29200, length 536
05:39:49.331541 IP (tos 0x0, ttl 64, id 65181, offset 0, flags [DF], proto TCP (6), length 576)
    169.254.144.1.55496 > 169.254.144.9.31276: Flags [.], cksum 0x7920 (correct), seq 41809:42345, ack 2, win 29200, length 536
05:39:49.331543 IP (tos 0x0, ttl 64, id 65182, offset 0, flags [DF], proto TCP (6), length 576)
    169.254.144.1.55496 > 169.254.144.9.31276: Flags [.], cksum 0xa0eb (correct), seq 42345:42881, ack 2, win 29200, length 536
05:39:49.333636 IP (tos 0x0, ttl 128, id 0, offset 0, flags [DF], proto TCP (6), length 40)
    169.254.144.9.31276 > 169.254.144.1.55496: Flags [.], cksum 0x50c0 (correct), seq 2, ack 38593, win 8192, length 0
05:39:49.338288 IP (tos 0x0, ttl 128, id 0, offset 0, flags [DF], proto TCP (6), length 40)
    169.254.144.9.31276 > 169.254.144.1.55496: Flags [.], cksum 0x50c0 (correct), seq 2, ack 38593, win 8192, length 0
05:39:49.338323 IP (tos 0x0, ttl 64, id 65183, offset 0, flags [DF], proto TCP (6), length 576)
    169.254.144.1.55496 > 169.254.144.9.31276: Flags [.], cksum 0xe50e (correct), seq 42881:43417, ack 2, win 29200, length 536
05:39:49.338801 IP (tos 0x0, ttl 128, id 0, offset 0, flags [DF], proto TCP (6), length 40)
    169.254.144.9.31276 > 169.254.144.1.55496: Flags [.], cksum 0x50c0 (correct), seq 2, ack 38593, win 8192, length 0
05:39:49.338914 IP (tos 0x0, ttl 128, id 0, offset 0, flags [DF], proto TCP (6), length 40)
    169.254.144.9.31276 > 169.254.144.1.55496: Flags [.], cksum 0x50c0 (correct), seq 2, ack 38593, win 8192, length 0
05:39:49.338922 IP (tos 0x0, ttl 64, id 65184, offset 0, flags [DF], proto TCP (6), length 576)
    169.254.144.1.55496 > 169.254.144.9.31276: Flags [P.], cksum 0x0628 (correct), seq 38593:39129, ack 2, win 29200, length 536
05:39:49.339178 IP (tos 0x0, ttl 128, id 0, offset 0, flags [DF], proto TCP (6), length 40)
    169.254.144.9.31276 > 169.254.144.1.55496: Flags [.], cksum 0x50c0 (correct), seq 2, ack 43417, win 3368, length 0
05:39:49.339189 IP (tos 0x0, ttl 64, id 65185, offset 0, flags [DF], proto TCP (6), length 576)
    169.254.144.1.55496 > 169.254.144.9.31276: Flags [.], cksum 0xa675 (correct), seq 43417:43953, ack 2, win 29200, length 536
05:39:49.339189 IP (tos 0x0, ttl 64, id 65186, offset 0, flags [DF], proto TCP (6), length 576)
    169.254.144.1.55496 > 169.254.144.9.31276: Flags [.], cksum 0x37e1 (correct), seq 43953:44489, ack 2, win 29200, length 536
05:39:49.339192 IP (tos 0x0, ttl 64, id 65187, offset 0, flags [DF], proto TCP (6), length 576)
    169.254.144.1.55496 > 169.254.144.9.31276: Flags [.], cksum 0x02ff (correct), seq 44489:45025, ack 2, win 29200, length 536
05:39:49.339192 IP (tos 0x0, ttl 64, id 65188, offset 0, flags [DF], proto TCP (6), length 576)
    169.254.144.1.55496 > 169.254.144.9.31276: Flags [.], cksum 0x7d2d (correct), seq 45025:45561, ack 2, win 29200, length 536
05:39:49.339194 IP (tos 0x0, ttl 64, id 65189, offset 0, flags [DF], proto TCP (6), length 576)
    169.254.144.1.55496 > 169.254.144.9.31276: Flags [.], cksum 0x6e13 (correct), seq 45561:46097, ack 2, win 29200, length 536
05:39:49.339386 IP (tos 0x0, ttl 128, id 0, offset 0, flags [DF], proto TCP (6), length 40)
    169.254.144.9.31276 > 169.254.144.1.55496: Flags [.], cksum 0x3de8 (correct), seq 2, ack 43953, win 7656, length 0
05:39:49.339393 IP (tos 0x0, ttl 64, id 65190, offset 0, flags [DF], proto TCP (6), length 576)
    169.254.144.1.55496 > 169.254.144.9.31276: Flags [P.], cksum 0x0565 (correct), seq 46097:46633, ack 2, win 29200, length 536
05:39:49.339396 IP (tos 0x0, ttl 64, id 65191, offset 0, flags [DF], proto TCP (6), length 576)
    169.254.144.1.55496 > 169.254.144.9.31276: Flags [.], cksum 0x7f8e (correct), seq 46633:47169, ack 2, win 29200, length 536
05:39:49.339397 IP (tos 0x0, ttl 64, id 65192, offset 0, flags [DF], proto TCP (6), length 576)
    169.254.144.1.55496 > 169.254.144.9.31276: Flags [.], cksum 0x6acd (correct), seq 47169:47705, ack 2, win 29200, length 536
05:39:49.339397 IP (tos 0x0, ttl 64, id 65193, offset 0, flags [DF], proto TCP (6), length 576)
    169.254.144.1.55496 > 169.254.144.9.31276: Flags [.], cksum 0x4e66 (correct), seq 47705:48241, ack 2, win 29200, length 536
05:39:49.339927 IP (tos 0x0, ttl 128, id 0, offset 0, flags [DF], proto TCP (6), length 40)
    169.254.144.9.31276 > 169.254.144.1.55496: Flags [.], cksum 0x3de8 (correct), seq 2, ack 44489, win 7120, length 0
05:39:49.339936 IP (tos 0x0, ttl 64, id 65194, offset 0, flags [DF], proto TCP (6), length 576)
    169.254.144.1.55496 > 169.254.144.9.31276: Flags [.], cksum 0xad8e (correct), seq 48241:48777, ack 2, win 29200, length 536
05:39:49.340132 IP (tos 0x0, ttl 128, id 0, offset 0, flags [DF], proto TCP (6), length 40)
    169.254.144.9.31276 > 169.254.144.1.55496: Flags [.], cksum 0x39b8 (correct), seq 2, ack 45025, win 7656, length 0
05:39:49.340138 IP (tos 0x0, ttl 64, id 65195, offset 0, flags [DF], proto TCP (6), length 576)
    169.254.144.1.55496 > 169.254.144.9.31276: Flags [.], cksum 0xe9dc (correct), seq 48777:49313, ack 2, win 29200, length 536
05:39:49.340164 IP (tos 0x0, ttl 128, id 0, offset 0, flags [DF], proto TCP (6), length 40)
    169.254.144.9.31276 > 169.254.144.1.55496: Flags [.], cksum 0x39b8 (correct), seq 2, ack 45561, win 7120, length 0
05:39:49.340169 IP (tos 0x0, ttl 64, id 65196, offset 0, flags [DF], proto TCP (6), length 576)
    169.254.144.1.55496 > 169.254.144.9.31276: Flags [.], cksum 0x1a97 (correct), seq 49313:49849, ack 2, win 29200, length 536
05:39:49.340322 IP (tos 0x0, ttl 128, id 0, offset 0, flags [DF], proto TCP (6), length 40)
    169.254.144.9.31276 > 169.254.144.1.55496: Flags [.], cksum 0x3588 (correct), seq 2, ack 46633, win 7120, length 0
05:39:49.340328 IP (tos 0x0, ttl 64, id 65197, offset 0, flags [DF], proto TCP (6), length 576)
    169.254.144.1.55496 > 169.254.144.9.31276: Flags [.], cksum 0xf057 (correct), seq 49849:50385, ack 2, win 29200, length 536
05:39:49.340330 IP (tos 0x0, ttl 64, id 65198, offset 0, flags [DF], proto TCP (6), length 576)
    169.254.144.1.55496 > 169.254.144.9.31276: Flags [.], cksum 0x3548 (correct), seq 50385:50921, ack 2, win 29200, length 536
05:39:49.340501 IP (tos 0x0, ttl 128, id 0, offset 0, flags [DF], proto TCP (6), length 40)
    169.254.144.9.31276 > 169.254.144.1.55496: Flags [.], cksum 0x3158 (correct), seq 2, ack 47169, win 7656, length 0
05:39:49.341681 IP (tos 0x0, ttl 128, id 0, offset 0, flags [DF], proto TCP (6), length 40)
    169.254.144.9.31276 > 169.254.144.1.55496: Flags [.], cksum 0x3158 (correct), seq 2, ack 47705, win 7120, length 0
05:39:49.342023 IP (tos 0x0, ttl 128, id 0, offset 0, flags [DF], proto TCP (6), length 40)
    169.254.144.9.31276 > 169.254.144.1.55496: Flags [.], cksum 0x2d28 (correct), seq 2, ack 48777, win 7120, length 0
05:39:49.342040 IP (tos 0x0, ttl 64, id 65199, offset 0, flags [DF], proto TCP (6), length 576)
    169.254.144.1.55496 > 169.254.144.9.31276: Flags [.], cksum 0xf6a4 (correct), seq 50921:51457, ack 2, win 29200, length 536
05:39:49.342040 IP (tos 0x0, ttl 64, id 65200, offset 0, flags [DF], proto TCP (6), length 576)
    169.254.144.1.55496 > 169.254.144.9.31276: Flags [.], cksum 0x3f5a (correct), seq 51457:51993, ack 2, win 29200, length 536
05:39:49.342041 IP (tos 0x0, ttl 64, id 65201, offset 0, flags [DF], proto TCP (6), length 576)
    169.254.144.1.55496 > 169.254.144.9.31276: Flags [.], cksum 0x8b26 (correct), seq 51993:52529, ack 2, win 29200, length 536
05:39:49.342041 IP (tos 0x0, ttl 64, id 65202, offset 0, flags [DF], proto TCP (6), length 576)
    169.254.144.1.55496 > 169.254.144.9.31276: Flags [.], cksum 0x3c96 (correct), seq 52529:53065, ack 2, win 29200, length 536
05:39:49.342290 IP (tos 0x0, ttl 128, id 0, offset 0, flags [DF], proto TCP (6), length 40)
    169.254.144.9.31276 > 169.254.144.1.55496: Flags [.], cksum 0x28f8 (correct), seq 2, ack 49313, win 7656, length 0
05:39:49.342320 IP (tos 0x0, ttl 128, id 0, offset 0, flags [DF], proto TCP (6), length 40)
    169.254.144.9.31276 > 169.254.144.1.55496: Flags [.], cksum 0x28f8 (correct), seq 2, ack 49849, win 7120, length 0
05:39:49.342328 IP (tos 0x0, ttl 64, id 65203, offset 0, flags [DF], proto TCP (6), length 576)
    169.254.144.1.55496 > 169.254.144.9.31276: Flags [.], cksum 0xae5e (correct), seq 53065:53601, ack 2, win 29200, length 536
05:39:49.342328 IP (tos 0x0, ttl 64, id 65204, offset 0, flags [DF], proto TCP (6), length 576)
    169.254.144.1.55496 > 169.254.144.9.31276: Flags [P.], cksum 0x1a05 (correct), seq 53601:54137, ack 2, win 29200, length 536
05:39:49.342509 IP (tos 0x0, ttl 128, id 0, offset 0, flags [DF], proto TCP (6), length 40)
    169.254.144.9.31276 > 169.254.144.1.55496: Flags [.], cksum 0x24c8 (correct), seq 2, ack 50385, win 7656, length 0
05:39:49.342517 IP (tos 0x0, ttl 64, id 65205, offset 0, flags [DF], proto TCP (6), length 576)
    169.254.144.1.55496 > 169.254.144.9.31276: Flags [.], cksum 0x32ea (correct), seq 54137:54673, ack 2, win 29200, length 536
05:39:49.342571 IP (tos 0x0, ttl 128, id 0, offset 0, flags [DF], proto TCP (6), length 40)
    169.254.144.9.31276 > 169.254.144.1.55496: Flags [.], cksum 0x24c8 (correct), seq 2, ack 50921, win 7120, length 0
05:39:49.342579 IP (tos 0x0, ttl 64, id 65206, offset 0, flags [DF], proto TCP (6), length 576)
    169.254.144.1.55496 > 169.254.144.9.31276: Flags [.], cksum 0x2c5d (correct), seq 54673:55209, ack 2, win 29200, length 536
05:39:49.342811 IP (tos 0x0, ttl 128, id 0, offset 0, flags [DF], proto TCP (6), length 40)
    169.254.144.9.31276 > 169.254.144.1.55496: Flags [.], cksum 0x2098 (correct), seq 2, ack 51993, win 7120, length 0
05:39:49.342822 IP (tos 0x0, ttl 64, id 65207, offset 0, flags [DF], proto TCP (6), length 576)
    169.254.144.1.55496 > 169.254.144.9.31276: Flags [.], cksum 0x2b60 (correct), seq 55209:55745, ack 2, win 29200, length 536
05:39:49.342822 IP (tos 0x0, ttl 64, id 65208, offset 0, flags [DF], proto TCP (6), length 576)
    169.254.144.1.55496 > 169.254.144.9.31276: Flags [.], cksum 0x8d2a (correct), seq 55745:56281, ack 2, win 29200, length 536
05:39:49.344006 IP (tos 0x0, ttl 128, id 0, offset 0, flags [DF], proto TCP (6), length 40)
    169.254.144.9.31276 > 169.254.144.1.55496: Flags [.], cksum 0x1c68 (correct), seq 2, ack 52529, win 7656, length 0
05:39:49.344025 IP (tos 0x0, ttl 64, id 65209, offset 0, flags [DF], proto TCP (6), length 576)
    169.254.144.1.55496 > 169.254.144.9.31276: Flags [.], cksum 0xfdf7 (correct), seq 56281:56817, ack 2, win 29200, length 536
05:39:49.344027 IP (tos 0x0, ttl 64, id 65210, offset 0, flags [DF], proto TCP (6), length 568)
    169.254.144.1.55496 > 169.254.144.9.31276: Flags [FP.], cksum 0x3672 (correct), seq 56817:57345, ack 2, win 29200, length 528
05:39:49.344975 IP (tos 0x0, ttl 128, id 0, offset 0, flags [DF], proto TCP (6), length 40)
    169.254.144.9.31276 > 169.254.144.1.55496: Flags [.], cksum 0x1c68 (correct), seq 2, ack 53065, win 7120, length 0
05:39:49.345299 IP (tos 0x0, ttl 128, id 0, offset 0, flags [DF], proto TCP (6), length 40)
    169.254.144.9.31276 > 169.254.144.1.55496: Flags [.], cksum 0x1838 (correct), seq 2, ack 53601, win 7656, length 0
05:39:49.345339 IP (tos 0x0, ttl 128, id 0, offset 0, flags [DF], proto TCP (6), length 40)
    169.254.144.9.31276 > 169.254.144.1.55496: Flags [.], cksum 0x1838 (correct), seq 2, ack 54137, win 7120, length 0
05:39:49.345755 IP (tos 0x0, ttl 128, id 0, offset 0, flags [DF], proto TCP (6), length 40)
    169.254.144.9.31276 > 169.254.144.1.55496: Flags [.], cksum 0x0fd8 (correct), seq 2, ack 55745, win 7656, length 0
05:39:49.346917 IP (tos 0x0, ttl 128, id 0, offset 0, flags [DF], proto TCP (6), length 40)
    169.254.144.9.31276 > 169.254.144.1.55496: Flags [.], cksum 0x0fd8 (correct), seq 2, ack 56281, win 7120, length 0
05:39:49.347243 IP (tos 0x0, ttl 128, id 0, offset 0, flags [DF], proto TCP (6), length 40)
    169.254.144.9.31276 > 169.254.144.1.55496: Flags [.], cksum 0x0ba8 (correct), seq 2, ack 56817, win 7656, length 0
05:39:49.369677 IP (tos 0x0, ttl 64, id 65211, offset 0, flags [DF], proto TCP (6), length 568)
    169.254.144.1.55496 > 169.254.144.9.31276: Flags [FP.], cksum 0x3672 (correct), seq 56817:57345, ack 2, win 29200, length 528
05:39:49.370186 IP (tos 0x0, ttl 128, id 0, offset 0, flags [DF], proto TCP (6), length 40)
    169.254.144.9.31276 > 169.254.144.1.55496: Flags [.], cksum 0x098f (correct), seq 2, ack 57346, win 7664, length 0